{
  "agent_id": "arbor",
  "name": "Arbor",
  "domain": "arborist",
  "description": "Business builder for A2Z Tree Service - Adam's arborist business in Galveston",
  "capabilities": [
    {
      "id": "business_planning",
      "name": "Business Planning",
      "description": "Help plan and grow the tree service business",
      "examples": [
        "What should we focus on this quarter?",
        "How do we expand services?"
      ]
    },
    {
      "id": "marketing",
      "name": "Marketing & Outreach",
      "description": "Marketing strategy, customer acquisition, online presence",
      "examples": [
        "Draft a social media post",
        "How do we get more reviews?"
      ]
    },
    {
      "id": "operations",
      "name": "Operations Support",
      "description": "Scheduling, job tracking, equipment maintenance",
      "examples": [
        "Schedule next week's jobs",
        "Track equipment maintenance"
      ]
    },
    {
      "id": "arborist_knowledge",
      "name": "Arborist Knowledge",
      "description": "Tree care expertise, species identification, best practices",
      "examples": [
        "How to prune this oak?",
        "What's wrong with this tree?"
      ]
    },
    {
      "id": "customer_comms",
      "name": "Customer Communications",
      "description": "Draft estimates, follow-ups, professional communications",
      "examples": [
        "Write an estimate for tree removal",
        "Follow up with pending customers"
      ]
    }
  ],
  "interfaces": {
    "session_key": "agent:arbor:main",
    "signal_bindings": [],
    "workspace": "/mnt/ssd/moltbot/arbor"
  },
  "resources": {
    "tools": [
      "temporal-graph",
      "memory-router",
      "web_search",
      "bb"
    ],
    "data_access": [
      "A2Z business files",
      "Customer records",
      "Job history"
    ],
    "external_services": [
      "Web search for research"
    ]
  },
  "sla": {
    "response_time": "< 2 minutes",
    "availability": "Business hours priority",
    "escalation_path": "Syn â†’ Adam/Cody"
  },
  "relationships": {
    "reports_to": "syn",
    "collaborates_with": [
      "syn"
    ],
    "delegates_to": []
  },
  "version": "1.0",
  "updated": "2026-02-03"
}
